,,2026年2月28日 (土曜日) 07:52:00,,
,日経1,トランプ氏、アンソロピックのAI「連邦政府全体で使用停止」 2026/2/28,時事1,高市首相、皇位継承「男系男子限定が適切」 木原官房長官、養子縁組念頭
,日経2,高市早苗首相「私に恥かかせるな」 米関税交渉担う赤沢亮正経産相に,時事2,高市首相との論戦、マナーに配慮 中道・小川氏「女性を意識」
,日経3,NYダウ、イラン緊迫で521ドル安 米長期金利4%割れ・原油急伸,時事3,高市首相との論戦、マナーに配慮 中道・小川氏「女性を意識」
,日経4,英住宅ローン会社破綻、損失不安で金融株急落 米ジェフリーズ9%安,時事4,元照ノ富士が弟子に暴力 協会聴取に応じる―大相撲
,日経5,出光、製油所閉鎖を撤回 EV伸びず脱炭素足踏み,時事5,サッカー、なでしこから消えた「白」 生理や下着の透け考慮―男女でユニ
,日経6,「昭和っぽい会社」はムダだらけ 脱JTC進めるレゾナック高橋社長［映,時事6,社民党首選、福島氏が出馬表明
,日経7,DeepSeekなど中国3社が「蒸留」でAI能力抽出 アンソロピック,時事7,りくりゅうが世界選手権辞退 五輪金ペア「心身戻せない」―フィギュアス
,日経8,ソフトバンクG、4.6兆円追加出資 オープンAIに,時事8,日本、レアアースで協力 採掘技術をマレーシアに
,日経9,米国、在イスラエル大使館職員を退避へ 英国はイランから避難,時事9,文春側に２９７万円賠償命令 西村元経産相への名誉毀損―東京地裁
,日経10,（データで読む地域再生）美しき道、観光に磨き 「風景街道」全国147,時事10,訪日客、未認証は搭乗拒否 航空会社に義務、２８年度導入―入管法改正案
,yahoo1,パキスタンの衝突 中露など仲介へ,yahoo経済1,カリスマ永守重信氏 唐突な辞任劇
,yahoo2,皇位継承巡る首相発言 木原氏釈明,yahoo経済1,NTTデータ インドで5000人増強へ
,yahoo3,水戸女性殺害 車に紛失防止タグ,yahoo経済1,パナ子会社取締役 性的言動で解任
,yahoo4,2歳女児が死亡 ひき逃げの可能性,yahoo経済4,任天堂の政策株 最大3300億円売却
,yahoo5,原発検査官 九電担当者をどう喝か,yahoo経済5,トリキバーガー唯一の店舗 閉店へ
,yahoo国際1,米 国民にイラン渡航中止を勧告,yahoo芸能1,ポケモン新作の映像公開 見どころ
,yahoo国際2,パキスタンの衝突 中露など仲介へ,yahoo芸能2,ポケモン 完全新作のゲーム発表
,yahoo国際3,中国無人機 他国機になりすまし,yahoo芸能3,LUNA SEA 真矢さん献花式実施へ
,yahoo国際4,米イランの核協議が終了「進展」,yahoo芸能4,沢尻エリカ 6年ぶり舞台あいさつ
,yahoo国際5,クリントン氏 米富豪巡り証言,yahoo芸能5,物議 漫画「常人仮面」を配信停止
,BBC,金正恩氏、アメリカが北朝鮮の核保有を認めれば「良好な関係」築けると 5年ぶり党大会,yahooスポーツ1,【フィギュア】マリニンに浮気騒動 美女メダリストと親密動画→相手彼
,BBC,アメリカとイランの核協議が終了、「大きな進展」あったと仲介国オマーンの外相,yahooスポーツ2,「裏切り者が稼いだドルは剥奪せよ」トランプの共和党議員が米で反発強
,BBC,ロシア、ウクライナに1000人以上の遺体を返還と発表 自国兵35人の遺体も受け取ったと,yahooスポーツ3,【フィギュア】元世界女王メドベージェワ 五輪採点に疑問符「グメニク
,BBC,部隊の指揮官が兵士を処刑、拷問……逃亡したロシア兵がBBCに証言,yahooスポーツ4,小塚崇彦さん、「この人なくして、今のスケート界無いよ」安藤美姫さん
,BBC,エプスティーン元被告の資料、新たに数百万点公開 何がわかったのか,yahooスポーツ5,CLラウンド16の対戦カードが確定！ マンCとレアルがまたも激突…
,,,,
,,,,
,,,,
,,,,
,,1 トランプ氏、アンソロピックのAI「連邦政府全体で使用停止」 2026/2/28 6:36 ,,6 「昭和っぽい会社」はムダだらけ 脱JTC進めるレゾナック高橋社長［映像あり］ 2026/2/28 5:00 
,,2 高市早苗首相「私に恥かかせるな」 米関税交渉担う赤沢亮正経産相に 2026/2/27 21:40 ,,7 DeepSeekなど中国3社が「蒸留」でAI能力抽出 アンソロピックが主張 2026/2/28 3:13 
,,3 NYダウ、イラン緊迫で521ドル安 米長期金利4%割れ・原油急伸 2026/2/28 1:28 ,,8 ソフトバンクG、4.6兆円追加出資 オープンAIに 2026/2/28付 
,,4 英住宅ローン会社破綻、損失不安で金融株急落 米ジェフリーズ9%安 2026/2/28 3:18 ,,9 米国、在イスラエル大使館職員を退避へ 英国はイランから避難 2026/2/28 0:26 
,,5 出光、製油所閉鎖を撤回 EV伸びず脱炭素足踏み 6拠点を維持、計画修正 2026/2/28付 ,,"10 （データで読む地域再生）美しき道、観光に磨き 「風景街道」全国147ルート 鳥取・八頭町 柵やポスト、柿映える茶色に 
2026/2/28付 "